{
  "pack": "patterns-pack-0.1",
  "version": "0.1",
  "generated_from": "patterns/*.md",
  "patterns": [
    {
      "id": "executor-layer-credentials",
      "title": "Executor-layer credentials (#806)",
      "description": "Secrets for privileged operations MUST be bound at the **invocation layer** (the orchestrator, the command definition, the trusted shim that wraps the capability) -- never inside the agent's context window, prompt, filesystem, or globally-inherited environment. The agent receives access to the **capability**, not the **credential**.",
      "triggers": [
        "executor-layer-credentials"
      ],
      "path": "patterns/executor-layer-credentials.md",
      "body": null
    },
    {
      "id": "llm-app",
      "title": "LLM application standards (#481)",
      "description": "Architectural standards for projects that call LLM APIs (OpenAI, Anthropic, Cohere, local models, etc.) or that build agentic functionality on top of those calls. These standards are cross-language and cross-interface; they sit alongside `languages/`, `interfaces/`, `platforms/`, and `coding/` and answer the orthogonal question \"how do I architect a system of this type safely?\"",
      "triggers": [
        "llm-app"
      ],
      "path": "patterns/llm-app.md",
      "body": null
    },
    {
      "id": "multi-agent",
      "title": "Multi-agent identity separation pattern (#983)",
      "description": "Status: stable pattern, v1 docs-only. v1 deliberately scopes to a single shared bot/App credential for all workers; per-worker token rotation is deferred to a follow-up. Per #983 non-goals.",
      "triggers": [
        "multi-agent"
      ],
      "path": "patterns/multi-agent.md",
      "body": "# Multi-agent identity separation pattern (#983)\n\n> Status: stable pattern, v1 docs-only. v1 deliberately scopes to a single\n> shared bot/App credential for all workers; per-worker token rotation is\n> deferred to a follow-up. Per #983 non-goals.\n\nThis pattern lays out *whose* GitHub identity dispatched swarm workers\nshould authenticate as, *why* that should not be the maintainer's PAT,\nand *how* operators provision and rotate the worker credential.\n\nIt is the credential-separation track that was carved out of #976\n(`fix(scm,tests): eliminate remaining GraphQL-backed scm.py / live SCM\nsmoke bucket drain after #961`). #976 owns the REST migration; this\npattern owns the orthogonal identity separation. The two tracks are\ncomplementary: REST migration reduces GraphQL demand on the shared\nbucket, identity separation prevents human and machine traffic from\nsharing one bucket in the first place.\n\n## Why this matters\n\nToday, swarm workers and the maintainer share a single GitHub Personal\nAccess Token (PAT). One PAT serves the maintainer's interactive review\nflow AND every worker spawned by `task swarm:*` / `start_agent` /\n`oz agent run`. The operational consequences observed in the\n2026-05-07 multi-agent session and again on 2026-05-08 are concrete:\n\n- **Bucket coupling**: GitHub's GraphQL bucket is **5,000 req/hr per\n  identity**. A swarm of N workers + the maintainer's terminal share\n  one bucket. When workers exhaust it (the documented failure mode for\n  the PR #652 / #561-class merge cascades), the maintainer's\n  `gh issue create` and `gh pr view` start failing with\n  `GraphQL: API rate limit already exceeded` -- the human is rate-\n  limited by their own swarm.\n- **Audit conflation**: every commit, comment, PR open, issue close,\n  and review submission attributes to the same `actor.login`. Forensic\n  separation (\"which action was the maintainer vs. an autonomous\n  worker?\") requires correlating timestamps and dispatch-envelope\n  prompts rather than reading the GitHub event stream directly.\n- **Credential blast radius**: a worker's prompt envelope is by\n  definition reviewable / loggable / inspectable -- prompts leak more\n  readily than secrets. Today a leaked worker prompt acts with the\n  full scope of the maintainer's PAT (issue close, PR merge, release\n  publish, branch protection bypass), not the narrow scope a worker\n  actually needs (issues:write, pulls:write, contents:read).\n\nReducing GraphQL demand (#976 REST migration) only solves bucket\n*pressure*. It does not solve bucket *coupling*, audit conflation, or\nblast radius. Those require partitioning the identity itself.\n\n## The pattern\n\n### Identity model\n\n- ! Workers MUST authenticate as a **distinct GitHub identity** from\n  the maintainer. Two acceptable shapes:\n  1. **GitHub App installation token** (preferred). The deft project\n     installs a GitHub App granting the minimum scopes; workers\n     consume an installation token derived from the App's private key.\n     Tokens are short-lived (~1 hour) and auto-rotated by GitHub.\n  2. **Bot account PAT**. A dedicated GitHub user account (e.g.\n     `deft-swarm-bot`) with its own PAT. Lower setup cost, but tokens\n     are long-lived until manually rotated, and the bot account\n     consumes a real GitHub seat.\n- ! Maintainer PATs MUST be reserved for human-driven work: review,\n  merge, release publication, manual triage. Worker dispatch envelopes\n  MUST NOT inject a maintainer PAT.\n- \u2297 Workers MUST NOT fall back to the host's `gh auth status` token.\n  The dispatch envelope is the contract; an implicit fallback re-\n  introduces the coupling this pattern eliminates.\n\n### Bucket partitioning model\n\n| Bucket               | Owner                | Use                                                |\n|----------------------|----------------------|----------------------------------------------------|\n| Maintainer GraphQL   | Maintainer PAT       | Human review, PR open/merge/ready, manual triage   |\n| Maintainer core REST | Maintainer PAT       | `gh api` reads outside swarm context               |\n| Worker GraphQL       | Bot account / App    | `markPullRequestReadyForReview`, `addPullRequestReview` (the only GraphQL surfaces a worker should hit; see #976 + #961) |\n| Worker core REST     | Bot account / App    | All other reads / mutations via `gh_rest.py` REST helpers |\n\nEach bucket is 5,000 req/hr (REST `core` and GraphQL each). With\nidentity separation the maintainer's two buckets are untouched by\nswarm activity, and N workers share *their own* two buckets.\n\nThe bucket partition only delivers value when paired with the #976\nREST migration: workers that still route reads through GraphQL\n(`gh issue view --json`, `gh pr view --json`, `gh pr ready`) will\nexhaust their own GraphQL bucket within minutes under N concurrent\npoll loops. REST-by-default per `templates/agent-prompt-preamble.md`\nS5 keeps the worker GraphQL bucket reserved for the unavoidable PR\nstate-mutation operations.\n\n### Dispatch-envelope credential rule\n\nThe canonical preamble at `templates/agent-prompt-preamble.md` carries\nthis rule verbatim alongside the existing REST-default,\nmax-1-Draft-toggle, and rate-limit-throttle rules:\n\n> Workers MUST consume the GitHub credential injected by the dispatcher\n> (typically `GH_TOKEN` in the prompt-supplied env). Workers MUST NOT\n> fall back to the host's `gh auth status` token. If `GH_TOKEN` is\n> unset and no other dispatcher-supplied credential is present, the\n> worker MUST fail loud with a clear error rather than silently\n> running under the host identity.\n\nThe rule is enforced at two points:\n\n1. **Dispatch time** (orchestrator side). The orchestrator (swarm\n   skill, monitor agent, scheduled run) injects the worker\n   credential into the dispatch envelope -- usually as `GH_TOKEN` in\n   the env, with the maintainer's `gh auth` state untouched. Workers\n   inherit this env at spawn time.\n2. **Worker side**. The worker's first action (after AGENTS.md read)\n   verifies `GH_TOKEN` is set and matches the expected bot/App\n   identity (e.g. `gh api user --jq .login` returns the bot login).\n   Mismatch is a hard refusal: stop the tool loop, send `BLOCKED:\n   identity mismatch` to the parent.\n\nThe two-sided enforcement means a missing/malformed credential surfaces\nat the earliest possible point rather than mid-dispatch when the worker\nhas already started writing files.\n\n### Permission scoping\n\n! The worker credential MUST be scoped down to the minimum needed:\n\n- `issues:write` -- open / close / comment / label\n- `pulls:write` -- open / merge / review / comment\n- `contents:read` -- read repo contents (for diff context)\n- `metadata:read` -- standard for any GitHub App\n- \u2297 `contents:write` -- workers MUST NOT push commits directly under\n  the worker identity. Pushes happen via the maintainer (interactive\n  review of the worker's diff) or via the GitHub App's restricted\n  contents:write scope on a specific bot-owned ref pattern.\n- \u2297 `admin:*` / `repo` (broad) -- workers MUST NOT have admin scopes.\n  Branch protection bypass, label/milestone management, secret\n  rotation -- all maintainer-only.\n\nThe maintainer PAT keeps the broader scope it has today (`repo`,\n`workflow`, etc.). The narrowness of the worker scope is half the\nblast-radius mitigation; the other half is short-lived credentials\n(GitHub App installation tokens auto-rotate ~1 hour; bot PATs MUST be\nrotated quarterly per the runbook below).\n\n## Operator runbook\n\n### Provisioning a worker identity\n\n#### Option A: GitHub App (preferred)\n\n1. Create a new GitHub App at\n   `https://github.com/organizations/<org>/settings/apps/new`\n   (account-level path: `https://github.com/settings/apps/new`).\n2. Grant the **minimum** permissions enumerated in\n   \"Permission scoping\" above. Decline every other permission.\n3. Subscribe to no events (workers consume the API; they do not need\n   webhook delivery).\n4. Generate and download a private key (`.pem`). Store it in\n   `secrets/swarm-app.pem` outside the repo (the deft `secrets/`\n   convention is `.gitignore`d by default per the repo conventions).\n5. Install the Ap